{
  "schema_version": "1.0",
  "id": "01KX8GXQSBJ684RHVQEGN9CHJA",
  "title": "多 Agent 架构原理与使用",
  "slug": "agent",
  "summary": "四份提示词契约 + ks 工具层 + 文件存储：判断与执行分离，单写者落盘，路由按用户根本目的分类。",
  "original_question": "给我介绍一下目前的多agent架构的原理，使用。请用一份白色学术风格的react网页进行说明",
  "domain": "knowledge-system",
  "tags": [
    "multi-agent",
    "architecture",
    "agents",
    "knowledge-system"
  ],
  "concepts": [
    "multi-agent architecture",
    "prompt contracts",
    "ks CLI",
    "single writer",
    "learning-guide",
    "persistence",
    "global-analysis",
    "project-modification",
    "four-layer stack"
  ],
  "relations": [
    {
      "type": "related",
      "target": "01KVN0RSRPWEGNHP0TSNPHC49R",
      "note": "更广义的 AI 智能体与工具调用循环；本仓库是文件型知识蒸馏的契约化多 Agent 实现"
    }
  ],
  "artifact": {
    "format": "react",
    "entry": "artifact/index.html",
    "self_contained": true
  },
  "status": "draft",
  "confidence": "solid",
  "created_at": "2026-07-11T12:02:36.971551+00:00",
  "updated_at": "2026-07-11T12:02:36.971551+00:00"
}
