{
  "schema_version": "1.0",
  "id": "01KXF633K0SP4Z7WACEM08MM7G",
  "title": "Electron：用 Web 技术构建跨平台桌面应用",
  "slug": "electron-web",
  "summary": "Electron 将 Chromium 与 Node.js 合为跨平台桌面运行时，核心是主进程/预加载/渲染的多进程模型与受控 IPC。",
  "original_question": "给我写一份学术风格的单HTML网页，讲解一下什么是 electron",
  "domain": "software-engineering",
  "tags": [
    "electron",
    "desktop",
    "javascript",
    "chromium",
    "node-js"
  ],
  "concepts": [
    "electron",
    "chromium",
    "node.js",
    "main-process",
    "renderer-process",
    "preload",
    "ipc",
    "context-bridge",
    "cross-platform-desktop"
  ],
  "references": [
    {
      "title": "Electron Documentation — Process Model",
      "url": "https://www.electronjs.org/docs/latest/tutorial/process-model"
    },
    {
      "title": "Electron Documentation — Security",
      "url": "https://www.electronjs.org/docs/latest/tutorial/security"
    }
  ],
  "artifact": {
    "format": "html",
    "entry": "artifact/index.html",
    "self_contained": true
  },
  "status": "draft",
  "confidence": "solid",
  "created_at": "2026-07-14T02:07:59.584349+00:00",
  "updated_at": "2026-07-14T02:07:59.584349+00:00"
}
